Точное земледелие;Сценарии применения технологий ЯндексОблако в сельском хозяйстве.;Яндекс;119021, г. Москва, Зубовский бульвар, д. 17, стр. 1;https://www.mcxac.ru/upload/iblock/e61/e61637c1ea8fdb6e8d80c0793f5f3f4b.pdf;cloud.yandex.ru;pr@yandex-team.ru;+7(495)739-70-00
СкайСкаут;Единая система для управления агрослужбой.;ИнтТерра;123112, г. Москва, Пресненская набережная, дом 12, этаж 45, пом.№3;https://www.mcxac.ru/upload/iblock/341/341506af3d1950376690552376e1ef59.pdf;www.intterra.ru;hello@intterra.ru;8(800)700-92-80
VPS (Virtual Private Server);Виртуальный хостинг сайтов для бизнеса с обслуживанием.;Rusonyx;125124, Москва, ул. Ямского поля 5-я, дом 9, Помещение II, 2 этаж, комната №19;https://www.mcxac.ruNone;www.rusonyx.ru;managers@rusonyx.ru;+7(495)248-19-01
Dairy Production Analytics;Цифровой двойник молочного производства.;АЛАН-ИТ;150054 г. Ярославль, ул. Чехова, д. 2;https://www.mcxac.ru/upload/iblock/9f6/9f65043ead44cdf5919759cd236c2a16.pdf;www.alan-it.ru/wkpages/default.aspx;info@alan-it.ru;+7(4852)37-03-03
Платформа ОПТИМУМ для разработки и эксплуатации мобильных и IoT/IIoT/EoT сервисов;;Группа компаний СиДиСи;111141, г. Москва, ул. Кусковская, Бизнес-центр «Кусково», 20а;https://www.mcxac.ruNone;cdc.ru;mail@cdc.ru;+7(495)956-13-25
ExactFarming;Онлайн-сервис планирования сельхозопераций и повышения эффективности агробизнеса.;ExactFarming;143026, г. Москва, территория инновационного центра  «Сколково», Большой бул., д. 42,  стр. 1;https://www.mcxac.ru/upload/iblock/f26/f267bb00f540126ca9a991e1b0feacf5.pdf;www.exactfarming.com;support@exactfarming.com;+7(499)346-64-38
Платформа «Зодиак»;Многомодульная структура, позволяющая собирать, обрабатывать и хранить информацию о контролируемых объектах.;РКСС-Программные системы;105005, Москва, ул. Бауманская, д.16, стр.1;https://www.mcxac.ruNone;www.pkcc-ps.ru;info@pkcc-ps.ru;+7(495)380-10-33
Решения АКВАРИУС для цифрового сельского хозяйства;Планшеты для мобильной работы в полевых условиях, российские продукты для построения цифровой инфраструктуры.;Aquarius;108811, г. Москва, Румянцево, Киевское ш. 6, стр.1, БЦ «Комсити»;https://www.mcxac.ru/upload/iblock/daf/dafb3ffbf57a56a5126ac8e01c9b90a8.pdf;www.aq.ru;question@aq.ru;+7(495)729-51-50
Мониторинг состояния сельскохозяйственных земель;Платформа промышленного интернета вещей и инструментов анализа для агрохолдингов.;Научно-исследовательский институт «Восход»;119607, г. Москва, ул. Удальцова, д.85;https://www.mcxac.ru/upload/iblock/c54/c54ad1e2e685010055d08c1d8560361b.pdf;voskhod.ru;info@voskhod.ru;+7(495)981-88-99
Решения для мониторинга промышленного оборудования;;;111141, г. Москва, ул. Кусковская, Бизнес-центр «Кусково», 20а;https://www.mcxac.ruNone;cdc.ru/solutions/optimum_platform;mail@cdc.ru;+7(495)956-13-25
None;None;None;None;https://www.mcxac.ruNone;None;None;None
Система «Агросигнал». Управление;Комплексная цифровая платформа для управления агробизнесом.;ИнфоБиС;410017, Саратовская область, г. Саратов, ул. Шелковичная, дом 11/15, эт. 6;https://www.mcxac.ru/upload/iblock/e45/e454da844683ff3ec08987ab794444ad.pdf;infobis.ru;agrosignal@infobis.ru;8(800)234-07-44
«История поля»;Облачный сервис для управления сельскохозяйственным предприятием.;Геомир;141006, Московская обл.,г. Мытищи, Олимпийский пр-т, 50;https://www.mcxac.ru/upload/iblock/d2f/d2fbd5a927f6c65f653fa8b06b66035f.pdf;www.geomir.ru;helpdesk@geomir.ru;+7(495)788-85-90
Агроаналитика-IoT;Комплексная платформа управления агропредприятием.;SmartAgro;121205, г. Москва, Территория Сколково Инновационного центра, ул. Нобеля , д. 7;https://www.mcxac.ru/upload/iblock/358/358c7542b54d072a88ce95894f40b297.pdf;smartagro.ru;sales@smartagro.ru;+7(960)669-87-09
LoRaWAN;Система беспроводных технологий передачи данных.;Булат;121471, г. Москва,  ул. Рябиновая, д.26;https://www.mcxac.ru/upload/iblock/453/4536de112b516d341e5e098d8fce1b80.pdf;opk-bulat.ru;info@opk-bulat.ru;+ 7(495)870-30-44
