Единая цифровая платформа-экосистема для повышения эффективности и прозрачности всех процессов для компаний АПК;;ИНЛАЙН ГРУП;125284, г. Москва, Хорошёвское ш., д. 38, корп.1, 3 этаж, пом.1, ком. 35;https://www.mcxac.ru/upload/iblock/809/8090b9dc60b25e753cb7af8cbbb9482e.pdf;inlinegroup.ru;info@inlinegroup.ru;+7(495)787-59-40
StaffCop Enterprise;Программный комплекс для контроля информации, действий пользователей и системных событий на рабочих компьютерах.;Атом Безопасность;630090, г. Новосибирск, проспект Академика Коптюга, д. 4;https://www.mcxac.ruNone;www.staffcop.ru;sales@staffcop.ru;+7(499)653-71-52
«Цифровое предприятие»;Отечественный комплекс информационных систем в защищенном исполнении, решающий задачи по управлению жищзненным циклом и ресурсами предприятия.;ВНИИЭФ;607188, Нижегородская обл., г. Саров, пр. Мира, 37;https://www.mcxac.ru/upload/iblock/f49/f493206322426447fe385bf872b41ee3.pdf;www.vniief.ru;staff@vniief.ru;+7(83130)2-48-02
Гарда Аналитика;П построения комплексных систем информационной безопасности.;Гарда Технологии;119607, г. Москва, Мичуринский пр-т, д.27 стр.5;https://www.mcxac.ru/upload/iblock/a17/a17a8215c88c2715853a9d892501c216.pdf;https://gardatech.ru;info@gardatech.ru;+7(495)540-05-27
Система электронного документооборота «Дело»;Решение для работы с документами.;Электронные Офисные Системы;107113, г. Москва, ул. Шумкина, д. 20 стр.1;https://www.mcxac.ruNone;www.eos.ru;partners@eos.ru;+7(495)737-99-91
«БФТ.е-Архив»;Экосистема хранения и анализа данных.;Бюджетные и финансовые технологии;127018, г. Москва, ул. Складочная, д.3, стр.1;https://www.mcxac.ruNone;https://bftcom.com;ineed@bftcom.com;+7(495)784-70-00
Строительство слаботочной инфраструктуры;;BELTEL;111250, Москва, проезд завода «Серп и Молот», д. 6, к. 1;https://www.mcxac.ruNone;https://www.beltel.ru;info@beltel.ru;+7(495)981-00-44
Оптимизация технологического процесса;Аналитика накопленных данных о протекании технологического процесса.;BELTEL;111250, Москва, проезд завода «Серп и Молот», д. 6, к. 1;https://www.mcxac.ruNone;https://www.beltel.ru;info@beltel.ru;+7(495)981-00-44
Интернет-платформа для коммуникации в сельскохозяйственной сфере;;Direct.Farm;350033, г. Краснодар, улица Ставропольская дом 45;https://www.mcxac.ru/upload/iblock/801/8011d6b8607e20663d387bc137aa9ad9.pdf;www.direct.farm;info@direct.farm;8(800)333-89-20
Информационное моделирование на базе технологии easyBIM;;РТЛабс;108811, г. Москва, 22 км. Киевского шоссе, д. 6 стр. 1;https://www.mcxac.ru/upload/iblock/21b/21bea385fb6609473cfcb5ea07d3b35e.pdf;https://www.rtlabs.ru;info@rtlabs.ru;+7(495)122-23-33
Directum RX;Интеллектуальная система управления цифровыми процессами и документами.;Directum;115432, г. Москва, проспект Андропова, д. 18, корп.7, 5 этаж, офис 13;https://www.mcxac.ru/upload/iblock/474/47468cb0b04e3db115e4170558369262.PDF;www.directum.ru;office@directum.ru;+7(499)277-15-60
"Акционерное общество  ""Республиканский информационно-вычислительный центр""";Цифровизация АПК, сбор аналитических показателей, разработка программного обеспечения, маркетинг;"АО ""РИВЦ""";420014, г. Казань, ул. Федосеевская д.36;https://www.mcxac.ru/upload/iblock/0b7/0b7ae0ccde31b85472056442e350dad3.pdf;www.rivts.ru;Danis.Sayfutdinov@tatar.ru;8 (800) 550-24-41
Сервисы для сельского хозяйства;;ExactFarming;143026, г. Москва, территория инновационного центра  «Сколково», Большой бул., д. 42,  стр. 1;https://www.mcxac.ru/upload/iblock/01b/01b8b09d1a868864ee3dd23d8dee7e64.pdf;www.exactfarming.com;support@exactfarming.com;+7(499)346-64-38
«Агрософт: Весовая»;Сервис для автоматизации учета взвешиваний в сельском хозяйстве.;"ООО ""АгроСофт""";353730, Краснодарский край, ст-ца Каневская, ул. Нестеренко 110а;https://www.mcxac.ru/upload/iblock/c65/c653413e144f74678b322369d13c2ff8.pdf;www.agrosoft.ru;ipyatina@agrosoft.ru;+7(495)215-51-74
AC «REGAGRO»: Пасека;Мобильное приложение для пчеловодов, автоматически предупреждающее об обработке полей агрохимикатами.;REGAGRO;143026,  г. Москва территория Инновационного центра «Сколково», ул.Нобеля, 7, 3/50/3;https://www.mcxac.ru/upload/iblock/1e8/1e8bed858a6385f5608eb66a2c39b18c.pdf;www.regagro.ru;direct@regagro.ru;+7(985)001-98-85
«Молочная ферма»;Мобильное приложение - система управления молочным стадом.;REGAGRO;143026,  г. Москва территория Инновационного центра «Сколково», ул.Нобеля, 7, 3/50/3;https://www.mcxac.ru/upload/iblock/12e/12eaa55567ea99bdbdad7c7c31867db1.pdf;www.1fmilk.ru;direct@regagro.ru;+7(985)001-98-85
AC «REGAGRO»: КПК Ветврач;Мобильное приложение для основных рабочих операций ветеринарного врача в полевых условиях.;REGAGRO;143026,  г. Москва территория Инновационного центра «Сколково», ул.Нобеля, 7, 3/50/3;https://www.mcxac.ru/upload/iblock/279/279d570e1a74b2b0a71b541378e32507.pdf;www.regagro.ru;direct@regagro.ru;+7(985)001-98-85
AC «REGAGRO»: Аналитика;Бесплатный программный комплекс для анализа эпизоотической ситуации в субъектах РФ.;REGAGRO;143026,  г. Москва территория Инновационного центра «Сколково», ул.Нобеля, 7, 3/50/3;https://www.mcxac.ru/upload/iblock/3c5/3c56692bd677f0efead5f92cd084bf95.pdf;www.regagro.ru;direct@regagro.ru;+7(985)001-98-85
AC «REGAGRO»: Отчетность;Программный компонент для автоматизации отчетности районных предприятий государственной ветеринарной службы.;REGAGRO;143026,  г. Москва территория Инновационного центра «Сколково», ул.Нобеля, 7, 3/50/3;https://www.mcxac.ru/upload/iblock/e57/e57729dcf36d5e285fb896525259e027.pdf;www.regagro.ru;direct@regagro.ru;+7(985)001-98-85
AC «REGAGRO»: Лаборатория ветеринарно-санитарной экспертизы;Программный компонент для лабораторий ветеринарно-санитарной экспертизы на рынках и убойных пунктах.;REGAGRO;143026,  г. Москва территория Инновационного центра «Сколково», ул.Нобеля, 7, 3/50/3;https://www.mcxac.ru/upload/iblock/d9a/d9afab6c749f415b207a567c901c5d60.pdf;www.regagro.ru;direct@regagro.ru;+7(985)001-98-85
AC «REGAGRO»: Эпизоотология;Программный комплекс по мониторингу эпизоотической ситуации и карантинных мер.;REGAGRO;143026,  г. Москва территория Инновационного центра «Сколково», ул.Нобеля, 7, 3/50/3;https://www.mcxac.ru/upload/iblock/15f/15fca88703d94c9a23d3486900ab2bb3.pdf;www.regagro.ru;direct@regagro.ru;+7(985)001-98-85
AC «REGAGRO»: Регистрация;Программный компонент для учета и регистрации сельскохозяйственных животных.;REGAGRO;143026,  г. Москва территория Инновационного центра «Сколково», ул.Нобеля, 7, 3/50/3;https://www.mcxac.ru/upload/iblock/22d/22df509e0f32c7cdc6c5d65bd19fab61.pdf;www.regagro.ru;direct@regagro.ru;+7(985)001-98-85
Агрокомплекс 3.0;Программное решение для планирования, оперативного и бухгалтерского учета на сельскохозяйственных и перерабатывающих предприятиях.;"ООО ""АдептИС""";394026, г. Воронеж, пр-т Труда, д. 111;https://www.mcxac.ru/upload/iblock/33b/33beb4a142319d7dcb22c70df1815e83.pdf;www.adeptis.ru;root@adeptis.ru;+7(473)207-03-47
PYLOT;Информационно-аналитическая платформа осуществляющая контроль и направленная на повышение эффективности тепличного производства.;PYLOT;101000, г. Москва, ул. Мясницкая, д.13, стр. 18;https://www.mcxac.ru/upload/iblock/188/188909651516ab7fa0af28ab4903e640.pdf;www.pylot.nl/ru;info@pylot.nl;+7(965)126-59-08
Hecterra;Приложение для агросектора, позволяющее отслеживать ход полевых работ на основе телематических данных.;Gurtam;111141, г. Москва, Зеленый пр-т, 5/12-149А;https://www.mcxac.ru/upload/iblock/ec7/ec74e62d1e414bc3095af0c3d82335dc.pdf;www.gurtam.com/ru;info@gurtam.com;+7(495)369-00-60
Direktiva.ai: Санитария;Система видеоаналитики гигиены рук.;Connectome.ai;127055, г. Москва, ул. Новослободская, д. 45, корп. В;https://www.mcxac.ru/upload/iblock/bca/bca6be2cc1ee5fe06406a3f5310bc8be.pdf;connectome.ai;info@connectome.ai;+7(495)369-01-95
Direktiva Tracking;Программное обеспечение для автоматического отслеживания работы персонала в птичниках и сбора статистики по выполнению регламента в производственных помещениях;Connectome.ai;127055, г. Москва, ул. Новослободская, д. 45, корп. В;https://www.mcxac.ru/upload/iblock/a63/a636c923c37d3de617b3d27c7dc15fec.pdf;connectome.ai;info@connectome.ai;+7(495)369-01-95
Animal Care:Calving;Система мониторинга рождения телят.;Connectome.ai;127055, г. Москва, ул. Новослободская, д. 45, корп. В;https://www.mcxac.ru/upload/iblock/c87/c872e8135f5765168932e131efa3a364.pdf;connectome.ai;info@connectome.ai;+7(495)369-01-95
"«Агросистема ""КлеверFarmer""»";Цифровая платформа для рационального управления растениеводством в агрохозяйствах.;"ООО ""Лаборатория Минимакс""";121205, г. Москва, Технопарк Сколково, ул. Нобеля, д.7;https://www.mcxac.ru/upload/iblock/da1/da1ca082aed9598e2119480fc5dd55fb.pdf;www.cleverfarmer.ru;info@cleverfarmer.ru;+7(495)657-98-78
«Свое Фермерство»;Цифровая экосистема для предприятий агропромышленного комплекса.;АО «Россельхозбанк»;123112, г. Москва, пресненская наб., д. 10, стр. 2;https://www.mcxac.ru/upload/iblock/a53/a53fbe85da5ce36a789d5d70b529b3fe.pdf;https://www.rshb.ru/;lyubaevaLV@rshb.ru;+7(495)787-77-87 (2249)
«Сам себе хозяин»;Специализированное мобильное приложение для самозанятых граждан.;АО «Россельхозбанк»;123112, г. Москва, пресненская наб., д. 10, стр. 2;https://www.mcxac.ru/upload/iblock/c48/c483b3b4d6c2d6cb41b47f869eeba7f0.pdf;www.rshb.ru;teslinav@rshb.ru;+7(495)787-77-87
Агро Маркетплейс;Web-сервис, использующий ГИС технологии;Аэромакс;115432, г. Москва, ул. Малая Дмитровка, д. 5/9;https://www.mcxac.ru/upload/iblock/616/616d7cce9386e1068d4250c77936e377.pdf;aerom.ax;info@aerom.ax;+7(495)921-42-42
Доильные системы Milkline;Эффективные решения для крупных хозяйств;Milkline;141280, Московская обл., Ивантеевка, Фабричный пр-д, 1;https://www.mcxac.ru/upload/iblock/0af/0afa50d794ab5553837a8822b39e6f81.pdf;www.milkline.com/ru;russia@milkline.com;+7(499)948-20-86
GIS WebServer AGRO;Удалённый доступ к системе управления земледелием сельскохозяйственного предприятия на основе ГИС «Панорама АГРО».;Конструкторское бюро «Панорама»;119017, Москва, Пыжевский переулок, д. 5, стр. 3, этаж 2, офис 4;https://www.mcxac.ru/upload/iblock/0bd/0bde6b18ce37d87cb54330eccd9fadc1.pdf;gisinfo.ru;kb@gisinfo.ru;+7(495)739-02-45
CRM;Прикладное программное обеспечение для дилера пшеницы и других зерновых.;Решения КлиК;Москва, ул. Ибрагимова, д 35, стр. 2, пом.1;https://www.mcxac.ru/upload/iblock/0b0/0b0b8342059668dfea50fff914f6ff13.pdf;www.sysclick.ru;office@sysclick.ru;+7(499)500-96-25
NIRS «Кормовая сеть»;Экономическая эффективность современных методов мониторинга питательности сырья для производства комбикормов.;МЕГАМИКС;400123, г. Волгоград, ул. Хрустальная, 107, оф.1;https://www.mcxac.ru/upload/iblock/da3/da3c0c320ad9e7091de67870ca6bacf5.pdf;https://www.megamix.ru;info@megamix.ru;+7(8442)97-97-97
Организация производства радиоэлектронных комплексов мониторинга статуса крупного рогатого скота;;РУТЕХ;Москва, Лихоборская наб., д. 8, строение 2, офис 24;https://www.mcxac.ru/upload/iblock/d18/d18b13b1b5a2e8b88056870974e76501.pdf;rutekh.ru;info@rutekh.ru;+7(495)419-01-70
DataFlow™ II;Система цифрового управления стадом.;Milkline;141280, Московская обл., Ивантеевка, Фабричный пр-д, 1;https://www.mcxac.ru/upload/iblock/8a0/8a041dd46de737e7d989bef355dc8a5b.pdf;www.milkline.com/ru;russia@milkline.com;+7(499)948-20-86
Nedap Livestock Management;Автоматизация сельского хозяйства с использованием индивидуальной идентификации животных.;Nedap;7141 DC Груэнло, Параллелвег 2, Нидерланды;https://www.mcxac.ru/upload/iblock/2aa/2aabaf78b753b95ec4194f3b27c54476.pdf;www.nedap-livestockmanagement.com;sale@securityrussia.com;+7-915-204-99-75
Оптимизация процесса уборки сельскохозяйственных угодий;;GMCS;119602, г. Москва,  ул. Покрышкина, д. 7;https://www.mcxac.ru/upload/iblock/efb/efb91a573511219eeea92f52981a8584.pdf;https://www.gmcs.ru;info@gmcs.ru;+7(495)737 99 91
АгроМон;Веб-сервис для управления растениеводческим предприятием.;АгроМон;;https://www.mcxac.ru/upload/iblock/eec/eec05175e92b7cd07a0cb9a83c306602.pdf;http://agromon.ru;: ep@agromon.ru;+7(915)000-64-98
АВЕРС: Управление лесным фондом ПРОФ;Информационная система комплексной автоматизации деятельности в области лесных отношений.;Аверс информ;453505, Респ. Башкортостан, г. Белорецк, ул. 50 лет Октября, 55/1;https://www.mcxac.ru/upload/iblock/e9f/e9fe71ce1b1cd8117235dd5b123ac22b.pdf;www.aversit.ru;32020@aversit.ru;+7(34792)3-20-20
Информационная платформа «Спаси пчел»;Технологии и коммуникации для предотвращения массовой гибели пчел.;Билайн;;https://www.mcxac.ru/upload/iblock/74f/74f49012bf7486f95e71988402002f15.pdf;moskva.beeline.ru/business/main;media@beeline.ru;+7(495)139-27-26
Чипирование домашних животных;Идентификация животных, упрощение поиска в случае потери, контроль состояние его здоровья.;Группа компаний «Техносерв»;111395, Москва, ул. Юности, д. 13;https://www.mcxac.ru/upload/iblock/3cc/3cc4e030551bf9fde1dd7f8a116e3a7b.pdf;https://technoserv.com;tsas@technoserv.com;+7(495) 790-79-79
АРМ инженера СХП;Инструмент для эффективного контроля над эксплуатацией, обслуживанием и ремонтом сельскохозяйственной техники.;Комплексные Цифровые Технологии;119270 г. Москва, ул. 3-я Фрунзенская, 9-153;https://www.mcxac.ru/upload/iblock/29d/29deb239ed2a6f12ba1d1621f2e62a1a.pdf;www.kctech.ru;info@kctech.ru;+7(985)768-37-64
SprutCAM;Автоматизация машиностроительного производства в АПК.;Центр СПРУТ-Т;111250, г. Москва, ул. Красноказарменная, д. 3, стр. 5;https://www.mcxac.ru/upload/iblock/b5c/b5c0c1a0e609562adacb9165efb3f7cf.pdf;csprut.ru;office@csprut.ru;8(800)775-84-22
Решения для сельского хозяйства;Контроль и инвентаризация полей.;МегаФон;127006, г. Москва, Оружейный переулок, д. 41, офис 517;https://www.mcxac.ru/upload/iblock/212/212df3f9f80847a865ca92d1829a796d.pdf;https://corp.megafon.ru;info@megafon.ru;+7(495)504-50-20
Delta Design;Система разработки и проектирования электронных устройств.;EREMEX;117437, г. Москва, ул. Профсоюзная 108;https://www.mcxac.ru/upload/iblock/614/6140f8054547920a0ab827e8089a7735.pdf;eremex.ru;info@eremex.ru;+7 (495) 232-18-64
Система планирования работы парка сельскохозяйственной техники;;Борлас;117105, Москва, Новоданиловская наб., дом 4а Телефон;https://www.mcxac.ru/upload/iblock/c96/c9698cabd5e22ba3675b6428394f8390.pdf;www.borlas.ru;info@borlas.ru;+7(495)478-77-00
БорласАгросистема;Информационно-аналитическая система управления производственными процессами в растениеводческом холдинге.;Борлас;117105, Москва, Новоданиловская наб., дом 4а;https://www.mcxac.ru/upload/iblock/c21/c21ab6cae661f9f860bfb8811cd4fff8.pdf;www.borlas.ru;info@borlas.ru;+7(495)478-77-00
«БАРС.Сельское хозяйство - Субсидирование»;Цифровизация процесса предоставления государственных услуг, связанных с субсидированием процентных ставок по кредитам граждан и СХТП в АПК.;БАРС Груп;115054, г. Москва, ул. Дубининская, 57, ст. 2;https://www.mcxac.ru/upload/iblock/4c0/4c0c1888a9de06e441957185f8f208ab.pdf;bars.group;bars@bars.group;8(800)500-01-91
«БАРС. Муниципалитет -Электронная хозяйственная книга»;Система оптимизации процессов учета личных подсобных хозяйств, контроля поступающей информации по сельским поселениям и городским округам в режиме онлайн.;БАРС Груп;115054, г. Москва, ул. Дубининская, 57, ст. 2;https://www.mcxac.ru/upload/iblock/d7c/d7c9494654baeb906232f92527d349dc.pdf;bars.group;bars@bars.group;8(800)500-01-91
ИАС «Мониторинг ветеринарии»;Сиситема сбора и анализа показателей отрасли ветеринарии в субъектах и муниципалитетах РФ.;БАРС Груп;115054, г. Москва, ул. Дубининская, 57, ст. 2;https://www.mcxac.ru/upload/iblock/530/530584f85b8c42508586a923dab27fb9.pdf;bars.group;bars@bars.group;8(800)500-01-91
Мониторинг Сельского хозяйства;Система сбора и анализа показателй сельскохозяйственной отрасли в субъектах и муниципалитетах РФ.;БАРС Груп;115054, г. Москва, ул. Дубининская, 57, ст. 2;https://www.mcxac.ru/upload/iblock/342/342638e08952d02d3de54592193bf7d2.pdf;bars.group;bars@bars.group;8(800)500-01-91
«Искусственный интеллект в помощь агроному»;Формирование оптимальной структуры посевных площадей.;Борлас;Россия, 117105, Москва, Новоданиловская наб., дом 4а;https://www.mcxac.ru/upload/iblock/319/3193a3d596989cf84f663096e0bb79ae.pdf;www.borlas.ru;info@borlas.ru;: +7(495)478-77-00
TELEMATICS;Объединенные в сеть сельскохозяйственные машины.;CLAAS;109147, г.Москва, ул. Таганская, 17-23, метро Марксистская;https://www.mcxac.ru/upload/iblock/3ff/3ff20169bfe9c4d19475a683f1804039.pdf;www.claas.ru;info-ru@claas.com;+7(495)644-13-74
«БАРС.Сельское хозяйство - Ветеринария»;Осуществления в цифровом формате процессов ветеринарного учёта.;БАРС Груп;115054, г. Москва, ул. Дубининская, 57, ст. 2,;https://www.mcxac.ru/upload/iblock/cc5/cc54626016633acf759b92da2c3c3897.pdf;bars.group;bars@bars.group;8(800)500-01-91
«БАРС.Сельское хозяйство - Ветнадзор»;Цифровая платформа ветеринарного надзора.;БАРС Груп;115054, г. Москва, ул. Дубининская, 57, ст. 2;https://www.mcxac.ru/upload/iblock/d54/d5463d49227f9eef17e71f623b5f8cbb.pdf;bars.group;bars@bars.group;8(800)500-01-91
ИАС «Управление строительством»;Решение для эффективного управления бизнес-процессами на всех этапах жизненного цикла объекта капитального строительства.;БАРС Груп;115054, г. Москва, ул. Дубининская, 57, ст. 2;https://www.mcxac.ru/upload/iblock/449/4499b5a5fc17d7b3a97cbb68d040f60f.pdf;bars.group;bars@bars.group;8(800)500-01-91
Высокоточные технологии на базе RTK станций;;Topcon;107023, г. Москва, ул. Малая Семеновская,  д.9, с.6;https://www.mcxac.ru/upload/iblock/236/2361b74741eb035124d291225e4b678d.pdf;agro.topcon.pro;agro@topcon.pro;+7(495)126-07-57
iDecide;Прототип электронной системы голосования, основанный на технологии блокчейн.;SolarLab;299011, г. Севастополь, ул. Большая Морская, д. 23, офис 370;https://www.mcxac.ru/upload/iblock/379/37924308a56c403629664f3609fa4439.pdf;www.solarlab.ru/index.html;office@solarl.ru;+7(978)793-44-24
Геоинформационная система сельского хозяйства;Система мониторинга земель сельскохозяйственного назначения.;DATUM Soft;344011, Ростовская область, г. Ростов-на-Дону, Доломановский переулок, дом 70г;https://www.mcxac.ru/upload/iblock/698/698a840e494a789c5b753c05099b3581.pdf;datum-soft.ru;soft@datum-soft.ru;+7(863)303-30-70
