Инвентаризация сельскохозяйственных земель;Геоинформационные системы и аэрокосмический мониторинг;Совзонд;115563, г. Москва, ул. Шипиловская, 28а, бизнес центр «Милан»;https://www.mcxac.ru/upload/iblock/53d/53d4cd7dc99ec3ca0dee4b1ae6f704dd.pdf;sovzond.ru;sovzond@sovzond.ru;+ 7(495)642-8870,
КОСМОСАГРО;Облачный онлайн-сервис для ведения непрерывного мониторинга состояния и использования сельскохозяйственных угодий, включая получение точных данных о границах полей, площадях посевов, состоянии сельскохозяйственных культур.;Группа компаний «СКАНЭКС»;г. Москва, 22-ой км. Киевского шоссе, домовладение 4, Бизнес-парк «Румянцево», корп. А, 8 подъезд, 8 этаж, офис 819А;https://www.mcxac.ru/upload/iblock/563/5635edcfd2562d7d4bc85e7821222be7.pdf;www.scanex.ru;info@scanex.ru;+7(495)739-73-85
Cервисы по оценке состояния сельскохозяйственных земель;;ZALA AERO GROUP;123154, г. Москва, ул. Саляма Адиля, д. 9к3;https://www.mcxac.ru/upload/iblock/789/789b8f02ce651cabaaba8a31204c2743.pdf;zala-aero.com;info@zala.aero;+7(495)66-55-120
Корпоративные геоинформационные системы;Услуги в области разработки геосервисов.;Prime group;123298, г. Москва, 3-я Хорошевская ул. д.12;https://www.mcxac.ru/upload/iblock/279/279e73459c8b4aea35c5032296f81bce.pdf;www.primegroup.ru;info@primegroup.ru;+7(499)579-77-01
Мониторинг и Цифровизация мелиоративных систем и гидротехнических сооружений;Мониторинг мелиоративных систем с использованием данных космической съемки и БПЛА;Аэромакс;115432, г. Москва, Россия, ул. Малая Дмитровка, д. 5/9;https://www.mcxac.ru/upload/iblock/1e6/1e656af502495dec6ee12420f2941b07.pdf;aerom.ax;info@aerom.ax;+7(495)921-42-42
WingtraOne;Беспилотный летательный аппарат для геодезии и картографии;Technokauf;108811, г. Москва, 22-й километр Киевское шоссе (п Московский), домовлад 4 стр 5, блок е этаж 4 офис 400е;https://www.mcxac.ru/upload/iblock/db5/db5be4cc552ef38a2ca92dc96244c848.pdf;technokauf.ru;info@technokauf.ru;+7(495)363-15-59
Оценка состояния и Инвентаризация сельхозугодий;Российский разработчик и производитель БПЛА.;ZALA AERO GROUP;123154, Москва, ул. Саляма Адиля, д. 9к3;https://www.mcxac.ru/upload/iblock/7ca/7ca51ec27923055f8d25b025704b8e66.pdf;zala-aero.com;info@zala.aero;+7(495)66-55-120
Сервис спутникового мониторинга сельскохозяйственных угодий;Мониторинг сельскохозяйственных угодий с использованием данных космической съемки и БПЛА;Аэромакс;115432, г. Москва, Россия, ул. Малая Дмитровка, д. 5/9;https://www.mcxac.ru/upload/iblock/68f/68fcd5da117df6558dd37a93fc34fb97.pdf;aerom.ax;info@aerom.ax;+7(495)921-42-42
Альбатрос;Беспилотные летательные комплексы для агросферы.;Геомир;141006, Московская обл.,г. Мытищи, Олимпийский пр-т, 50;https://www.mcxac.ru/upload/iblock/c80/c80a747d6ba3351ebd2e50a67c0cf0b6.pdf;www.geomir.ru;helpdesk@geomir.ru;+7(495)788-85-90
None;None;None;None;https://www.mcxac.ruNone;None;None;None
FIXAR;Эффективные дроны для решения отраслевых задач;FIXAR;192148, Санкт-Петербург, ул. Ольги Берггольц, д. 40, территория завода «Патриот»;https://www.mcxac.ru/upload/iblock/713/7133852e1d99e46a83d3395d11bf7244.pdf;fixar.pro;info@fixar.pro;+7(812)677-14-35
Мониторинг сельскохозяйственных объектов с помощью БПЛА;;Концерн «Автоматика»;127106, г. Москва, ул. Ботаническая, д.25;https://www.mcxac.ru/upload/iblock/022/0229ba06c62a8fa4da5c4dc522b11699.pdf;www.ao-avtomatika.ru;mail@ao-avtomatika.ru;+7(495)250-33-33
АгроФлот;Картография высокого разрешения для точного земледелия.;GeosAero;440026, г. Пенза, ул. Володарского, д. 2/ ул. Карла Маркса, д. 20;https://www.mcxac.ru/upload/iblock/dff/dff0db337995c9c731588b40bcf3f393.pdf;geosaero.ru;somov@geosaero.ru;+7(927)386-06-62
Инструменты аналитики и оценки эффективности для современного цифрового земледелия с помощью БПЛА;;GeosAero;440026, г. Пенза, ул. Володарского, д. 2/ ул. Карла Маркса, д. 20;https://www.mcxac.ru/upload/iblock/0c3/0c38786c00e7b6543b28618180d6780f.pdf;geosaero.ru;somov@geosaero.ru;+7(927)386-06-62
Геоскан 201 АГРО;Картографирование и мониторинг земель сельскохозяйственного назначения.;Геоскан;123242, Москва, ул. Большая Грузинская д. 12, строение 2+7(495)601-98-90;https://www.mcxac.ru/upload/iblock/aac/aac449b794ee31f7f5292cac4305bf96.pdf;www.geoscan.aero/ru;info@geoscan.aero;+7(495)601-98-90
Инвентаризация земель с помощью БПЛА;;Геоскан;123242, Москва, ул. Большая Грузинская д. 12, строение 2;https://www.mcxac.ru/upload/iblock/fab/fab78a926f4b1af93fa444192c7aa872.pdf;www.geoscan.aero/ru;info@geoscan.aero;+7(495)601-98-90
Беспилотная сельхозтехника;;Группа компаний «Техносерв»;111395, Москва, ул. Юности, д. 13;https://www.mcxac.ru/upload/iblock/3bf/3bfb89099a0d08a4106d7b10cd7ed80c.pdf;https://technoserv.com;tsas@technoserv.com;+7(495)790-79-79
